date,startTime,endTime,court,format,skillLevel,registered,capacity,pricePerPlayer,playerNames
2025-10-11,13:30,15:00,Court 2,OPEN_PLAY,ALL_LEVELS,4,12,12,"Kelly Wright; Tom Rivera; Kevin Lee; Chris Taylor"
2025-10-11,15:00,16:30,Court 3,CLINIC,BEGINNER,3,8,25,"Maria Santos; Brandon Hall; Ruby Bryant"
2025-10-12,07:30,09:00,Court 5,SOCIAL,ALL_LEVELS,3,8,15,"Brandon Hall; Charlotte Davis; Chris Taylor"
2025-10-12,09:00,10:30,Court 3,CLINIC,INTERMEDIATE,8,16,30,"Sophie Taylor; Sam Roberts; Owen Adams; Chloe Allen"
2025-10-12,10:30,12:00,Court 1,OPEN_PLAY,ALL_LEVELS,5,8,15,"Anna Garcia; Rachel Kim; Maria Santos; Grace Hall; James Wilson"
2025-10-12,12:00,13:30,Court 2,CLINIC,BEGINNER,6,12,25,"Anna Garcia; Sam Roberts; Logan Garcia; Diana Park; Priya Sharma"
2025-10-12,13:30,15:00,Court 2,SOCIAL,ALL_LEVELS,3,8,10,"Robert Ross; Asher Sullivan; Maria Santos"
2025-10-12,15:00,16:30,Court 5,SOCIAL,ALL_LEVELS,4,8,15,"Owen Adams; Mason Brown; James Wilson; Priya Sharma"
2025-10-12,18:00,19:30,Court 6,DRILL,ALL_LEVELS,5,6,20,"James Wilson; Lisa Park; Tom Rivera; Aurora Torres; Noah Harris"
2025-10-12,19:30,21:00,Court 3,LEAGUE_PLAY,INTERMEDIATE,3,4,40,"Alex Rivera; Isabella Clark; Megan Scott"
2025-10-13,06:00,07:30,Court 3,DRILL,ALL_LEVELS,1,6,20,"Alex Rivera"
2025-10-13,07:30,09:00,Court 4,SOCIAL,ALL_LEVELS,7,16,15,"Gabriel Cook; Tom Rivera; Claire Barnes; Sarah Mitchell"
2025-10-13,09:00,10:30,Court 3,LEAGUE_PLAY,INTERMEDIATE,3,4,35,"Priya Sharma; Lisa Park; Wyatt Young"
2025-10-13,10:30,12:00,Court 5,OPEN_PLAY,ALL_LEVELS,4,8,18,"David Brown; Jack Scott; Emily Hill; Levi Mitchell"
2025-10-13,12:00,13:30,Court 2,OPEN_PLAY,ALL_LEVELS,4,12,12,"James Wilson; Mason Brown; Sophia Lee; Maria Santos"
2025-10-13,13:30,15:00,Court 4,LEAGUE_PLAY,INTERMEDIATE,1,4,50,"Anna Garcia"
2025-10-13,16:30,18:00,Court 6,OPEN_PLAY,ALL_LEVELS,9,12,18,"Ethan Moore; Chris Taylor; Violet Reynolds; Scarlett Baker; Jack Scott; Amelia Wilson; David Brown; Kevin Lee; Alex Rivera"
2025-10-13,18:00,19:30,Court 2,CLINIC,BEGINNER,12,16,25,"Chris Taylor; Chloe Allen; Olivia Turner; Tom Rivera; Charlotte Davis; Henry Nelson; Lincoln Price; Anna Garcia; Ezra Griffin"
2025-10-13,19:30,21:00,Court 5,DRILL,ALL_LEVELS,5,8,18,"Kevin Lee; Eleanor Ward; Emma Johnson"
2025-10-13,21:00,22:00,Court 6,CLINIC,BEGINNER,3,8,20,"Alex Rivera; Sophie Taylor; Logan Garcia"
2025-10-14,06:00,07:30,Court 6,SOCIAL,ALL_LEVELS,3,16,15,"Chloe Allen; Sarah Mitchell; Nina Lopez"
2025-10-14,07:30,09:00,Court 1,OPEN_PLAY,ALL_LEVELS,2,8,15,"Victoria Hernandez; Grace Hall"
2025-10-14,10:30,12:00,Court 5,OPEN_PLAY,ALL_LEVELS,5,12,12,"Emma Johnson; Sophie Taylor; Chris Taylor; Kevin Lee"
2025-10-14,12:00,13:30,Court 5,DRILL,ALL_LEVELS,2,6,20,"Sophie Taylor; Alex Rivera"
2025-10-14,15:00,16:30,Court 3,SOCIAL,ALL_LEVELS,4,8,10,"Abigail Robinson; Sophie Taylor; Maria Santos; Owen Adams"
2025-10-14,18:00,19:30,Court 3,SOCIAL,ALL_LEVELS,12,16,10,"David Brown; Chris Taylor; Scarlett Baker; Ethan Moore"
2025-10-14,19:30,21:00,Court 4,CLINIC,BEGINNER,8,16,20,"Kevin Lee; Andrew Simmons; James Wilson; Emma Johnson"
2025-10-15,06:00,07:30,Court 5,DRILL,ALL_LEVELS,1,6,20,"Sarah Mitchell"
2025-10-15,09:00,10:30,Court 5,CLINIC,BEGINNER,5,8,20,"Josiah Ramirez; Olivia Turner"
2025-10-15,10:30,12:00,Court 2,CLINIC,BEGINNER,6,12,25,"Lisa Park; Amelia Wilson; Rachel Kim; Ava White; David Brown"
2025-10-15,12:00,13:30,Court 5,OPEN_PLAY,ALL_LEVELS,3,8,15,"James Wilson; Mason Brown; Logan Garcia"
2025-10-15,13:30,15:00,Court 3,CLINIC,INTERMEDIATE,3,8,20,"Elijah Anderson; Grace Hall; Anna Garcia"
2025-10-15,16:30,18:00,Court 4,SOCIAL,ALL_LEVELS,5,8,10,"Anna Garcia; Mark Johnson; James Wilson; Wyatt Young; Chloe Allen"
2025-10-15,18:00,19:30,Court 6,SOCIAL,ALL_LEVELS,6,8,15,"Rachel Kim; James Wilson; Amelia Wilson; Samuel Cox"
2025-10-15,19:30,21:00,Court 3,SOCIAL,ALL_LEVELS,10,16,10,"Mike Chen; Rachel Kim; Kevin Lee; Mark Johnson"
2025-10-15,21:00,22:00,Court 1,DRILL,ALL_LEVELS,1,6,15,"Sarah Mitchell"
2025-10-16,09:00,10:30,Court 1,SOCIAL,ALL_LEVELS,11,16,15,"David Brown; Abigail Robinson; Anna Garcia; Kelly Wright; Charlotte Davis; Tom Rivera"
2025-10-16,10:30,12:00,Court 2,OPEN_PLAY,ALL_LEVELS,4,8,15,"Ella Green; Emma Johnson; Chris Taylor; Carter Thompson"
2025-10-16,12:00,13:30,Court 2,CLINIC,INTERMEDIATE,3,8,25,"Priya Sharma; Sam Roberts; Abigail Robinson"
2025-10-16,13:30,15:00,Court 4,CLINIC,INTERMEDIATE,3,8,30,"Sarah Mitchell; Kevin Lee; Charlotte Davis"
2025-10-16,15:00,16:30,Court 2,CLINIC,INTERMEDIATE,4,8,25,"Ethan Moore; Ella Green; Nathan Patterson"
2025-10-16,16:30,18:00,Court 4,SOCIAL,ALL_LEVELS,6,8,15,"Ryan Foster; Chloe Allen; Aiden Thomas; Abigail Robinson; Maria Santos; Mike Chen"
2025-10-17,07:30,09:00,Court 4,SOCIAL,ALL_LEVELS,5,16,10,"Olivia Turner; Sophie Taylor; David Brown; Wyatt Young; Jayden Ward"
2025-10-17,09:00,10:30,Court 4,OPEN_PLAY,ALL_LEVELS,4,8,12,"Zoey Reed; Emma Johnson; Rachel Kim; Isabella Clark"
2025-10-17,16:30,18:00,Court 1,SOCIAL,ALL_LEVELS,4,8,10,"Emily Hill; Chris Taylor; Ethan Moore; Maria Santos"
2025-10-17,18:00,19:30,Court 6,LEAGUE_PLAY,ADVANCED,3,4,50,"Lisa Park; Victoria Hernandez; Rachel Kim"
2025-10-18,06:00,07:30,Court 4,OPEN_PLAY,ALL_LEVELS,2,8,18,"Rachel Kim; Elijah Anderson"
2025-10-18,09:00,10:30,Court 6,OPEN_PLAY,ALL_LEVELS,4,8,12,"Kevin Lee; Priya Sharma; Kelly Wright; Nora Morgan"
2025-10-18,10:30,12:00,Court 2,SOCIAL,ALL_LEVELS,7,16,15,"Chris Taylor; Henry Nelson; Grace Hall; Ella Green"
2025-10-18,12:00,13:30,Court 6,SOCIAL,ALL_LEVELS,2,8,10,"Chris Taylor; Lucas Martin"
2025-10-18,13:30,15:00,Court 5,OPEN_PLAY,ALL_LEVELS,4,12,18,"Jennifer Liu; James Wilson; Isabella Clark; Liam Nelson"
2025-10-18,16:30,18:00,Court 6,DRILL,ALL_LEVELS,3,6,15,"Rachel Kim; Sebastian Wright; Benjamin Walker"
2025-10-19,06:00,07:30,Court 4,SOCIAL,ALL_LEVELS,4,16,10,"Emma Johnson; Liam Nelson; Tom Rivera; Lisa Park"
2025-10-19,09:00,10:30,Court 6,SOCIAL,ALL_LEVELS,12,16,15,"Mark Johnson; Jaxon Ross; Emma Johnson; Lisa Park; Ella Green; Megan Scott"
2025-10-19,12:00,13:30,Court 6,SOCIAL,ALL_LEVELS,4,8,10,"Brandon Hall; Tom Rivera; Harper Jackson; Sarah Mitchell"
2025-10-19,15:00,16:30,Court 6,DRILL,ALL_LEVELS,4,8,15,"Tom Rivera; Aiden Thomas; Jake Rodriguez; Caleb King"
2025-10-19,16:30,18:00,Court 1,OPEN_PLAY,ALL_LEVELS,6,8,18,"Leo Robinson; Emma Johnson; Amelia Wilson; Priya Sharma; Victoria Hernandez; Sophia Lee"
2025-10-19,18:00,19:30,Court 1,CLINIC,INTERMEDIATE,8,8,25,"Ezra Griffin; Megan Scott; Lincoln Price; Mason Brown; Benjamin Walker; David Brown; James Wilson"
2025-10-19,19:30,21:00,Court 3,OPEN_PLAY,ALL_LEVELS,7,8,12,"Elijah Anderson; Grace Hall; Chris Taylor; Megan Scott; Rachel Kim"
2025-10-19,21:00,22:00,Court 5,OPEN_PLAY,ALL_LEVELS,4,12,18,"Kevin Lee; Sam Roberts; Sophie Taylor; Diana Park"
2025-10-20,06:00,07:30,Court 3,CLINIC,BEGINNER,2,8,20,"Alex Rivera; Tom Rivera"
2025-10-20,07:30,09:00,Court 5,LEAGUE_PLAY,ADVANCED,1,4,50,"Noah Harris"
2025-10-20,09:00,10:30,Court 3,LEAGUE_PLAY,INTERMEDIATE,3,4,40,"Wyatt Young; Evelyn Martinez; Maria Santos"
2025-10-20,13:30,15:00,Court 2,OPEN_PLAY,ALL_LEVELS,2,8,18,"Caleb King; Thomas Flores"
2025-10-20,16:30,18:00,Court 2,DRILL,ALL_LEVELS,7,8,18,"Savannah Sanders; Caleb King; Lisa Park; Grace Hall"
2025-10-20,18:00,19:30,Court 4,OPEN_PLAY,ALL_LEVELS,10,12,12,"Asher Sullivan; Leo Robinson; Harper Jackson; Lucas Martin; Ava White; Emily Hill; Stella Gray; Scarlett Baker; Lisa Park; James Wilson"
2025-10-20,19:30,21:00,Court 6,OPEN_PLAY,ALL_LEVELS,7,8,12,"Abigail Robinson; Nina Lopez; Mike Chen; Elijah Anderson; Sophia Lee; Maria Santos; Kevin Lee"
2025-10-20,21:00,22:00,Court 6,OPEN_PLAY,ALL_LEVELS,3,8,15,"Jayden Ward; Maria Santos; Chris Taylor"
2025-10-21,06:00,07:30,Court 5,SOCIAL,ALL_LEVELS,1,8,15,"Kevin Lee"
2025-10-21,07:30,09:00,Court 2,SOCIAL,ALL_LEVELS,5,16,15,"Rachel Kim; Kevin Lee; Anna Garcia; James Wilson; Ella Green"
2025-10-21,09:00,10:30,Court 6,LEAGUE_PLAY,ADVANCED,2,4,35,"Victoria Hernandez; Jake Rodriguez"
2025-10-21,10:30,12:00,Court 6,SOCIAL,ALL_LEVELS,4,8,10,"Olivia Turner; Benjamin Walker; Kevin Lee; Aiden Thomas"
2025-10-21,12:00,13:30,Court 3,CLINIC,BEGINNER,6,16,20,"Alex Rivera; Asher Sullivan; Diana Park; Luke Hayes; Caleb King; Tom Rivera"
2025-10-21,13:30,15:00,Court 1,OPEN_PLAY,ALL_LEVELS,3,12,15,"Sebastian Wright; James Wilson; Mason Brown"
2025-10-22,06:00,07:30,Court 6,OPEN_PLAY,ALL_LEVELS,2,12,15,"Olivia Turner; Carter Thompson"
2025-10-22,07:30,09:00,Court 1,SOCIAL,ALL_LEVELS,5,16,10,"Emma Johnson; Maria Santos; Mark Johnson; Caleb King; Tom Rivera"
2025-10-22,09:00,10:30,Court 1,SOCIAL,ALL_LEVELS,8,16,15,"Diana Park; Rachel Kim; Mark Johnson; Ava White; Jennifer Liu; Leo Robinson"
2025-10-22,12:00,13:30,Court 2,OPEN_PLAY,ALL_LEVELS,5,12,15,"Ethan Moore; Aiden Thomas; Lincoln Price; Carter Thompson; Henry Nelson"
2025-10-22,13:30,15:00,Court 2,CLINIC,BEGINNER,4,16,30,"James Wilson; Sophie Taylor; Ryan Foster; Penelope Lewis"
2025-10-22,15:00,16:30,Court 3,OPEN_PLAY,ALL_LEVELS,4,8,12,"Tom Rivera; Sarah Mitchell; Sebastian Wright; Priya Sharma"
2025-10-22,16:30,18:00,Court 4,SOCIAL,ALL_LEVELS,9,16,15,"Sophie Taylor; Mason Brown; Ava White; Maria Santos; Elijah Anderson"
2025-10-22,18:00,19:30,Court 5,CLINIC,INTERMEDIATE,10,16,25,"Victoria Hernandez; James Wilson; Sarah Mitchell; Sam Roberts; Sophie Taylor"
2025-10-22,21:00,22:00,Court 5,OPEN_PLAY,ALL_LEVELS,3,12,15,"David Brown; Mark Johnson; Abigail Robinson"
2025-10-23,07:30,09:00,Court 5,OPEN_PLAY,ALL_LEVELS,3,8,12,"Ella Green; Abigail Robinson; Tom Rivera"
2025-10-23,09:00,10:30,Court 1,SOCIAL,ALL_LEVELS,5,8,10,"Bella Bennett; Mike Chen; Aiden Thomas; Samuel Cox; Chris Taylor"
2025-10-23,13:30,15:00,Court 6,CLINIC,INTERMEDIATE,3,12,25,"Henry Nelson; Chloe Allen; Mike Chen"
2025-10-23,15:00,16:30,Court 1,OPEN_PLAY,ALL_LEVELS,5,12,15,"Lisa Park; James Wilson; Mike Chen; Scarlett Baker; Anna Garcia"
2025-10-23,16:30,18:00,Court 4,CLINIC,INTERMEDIATE,6,8,25,"Mark Johnson; Priya Sharma; Rachel Kim; Anna Garcia"
2025-10-23,18:00,19:30,Court 1,OPEN_PLAY,ALL_LEVELS,10,12,15,"Penelope Lewis; Matthew Bell; Jaxon Ross; Lisa Park; Emma Johnson; Alex Rivera; Logan Garcia"
2025-10-24,06:00,07:30,Court 5,DRILL,ALL_LEVELS,2,8,15,"Tom Rivera; Samuel Cox"
2025-10-24,07:30,09:00,Court 5,OPEN_PLAY,ALL_LEVELS,2,8,18,"Caleb King; Alex Rivera"
2025-10-24,09:00,10:30,Court 3,OPEN_PLAY,ALL_LEVELS,7,12,18,"Sophie Taylor; Diana Park; Joshua Ross; Levi Mitchell; Mike Chen; Emma Johnson; Chloe Allen"
2025-10-24,10:30,12:00,Court 6,OPEN_PLAY,ALL_LEVELS,5,8,12,"Willow Diaz; Chris Taylor; Lisa Park; Addison Howard"
2025-10-24,12:00,13:30,Court 2,DRILL,ALL_LEVELS,2,6,15,"Ella Green; Mike Chen"
2025-10-24,13:30,15:00,Court 3,DRILL,ALL_LEVELS,1,6,15,"Aurora Torres"
2025-10-24,15:00,16:30,Court 2,CLINIC,INTERMEDIATE,4,12,30,"Emma Johnson; Grace Hall; Lisa Park"
2025-10-24,16:30,18:00,Court 3,DRILL,ALL_LEVELS,5,6,15,"Evelyn Martinez; Sarah Mitchell; Mateo Cruz; David Brown; Henry Nelson"
2025-10-24,19:30,21:00,Court 2,SOCIAL,ALL_LEVELS,4,8,10,"Alex Rivera; Nina Lopez; Mason Brown; Lisa Park"
2025-10-24,21:00,22:00,Court 1,SOCIAL,ALL_LEVELS,4,16,10,"Jake Rodriguez; Isabella Clark; Mason Brown"
2025-10-25,06:00,07:30,Court 5,OPEN_PLAY,ALL_LEVELS,3,12,12,"Chris Taylor; Jake Rodriguez; Sophia Lee"
2025-10-25,09:00,10:30,Court 3,SOCIAL,ALL_LEVELS,10,16,15,"Chris Taylor; Maria Santos; Aiden Thomas; David Brown; Victoria Hernandez; Nina Lopez; Asher Sullivan; Carter Thompson; Emma Johnson"
2025-10-25,10:30,12:00,Court 3,DRILL,ALL_LEVELS,3,6,20,"Alex Rivera; Rachel Kim; Anthony Butler"
2025-10-25,12:00,13:30,Court 2,CLINIC,BEGINNER,3,8,30,"Aurora Torres; Mason Brown; James Wilson"
2025-10-25,13:30,15:00,Court 2,CLINIC,BEGINNER,3,12,20,"Emma Johnson; Kevin Lee; Ezra Griffin"
2025-10-25,16:30,18:00,Court 6,LEAGUE_PLAY,INTERMEDIATE,3,4,50,"Isabella Clark; Priya Sharma; Lisa Park"
2025-10-25,18:00,19:30,Court 1,OPEN_PLAY,ALL_LEVELS,8,12,18,"Emma Johnson; David Brown; Brandon Hall; Sam Roberts; Aurora Torres"
2025-10-25,19:30,21:00,Court 5,DRILL,ALL_LEVELS,3,6,20,"Willow Diaz; Elijah Anderson; Wyatt Young"
2025-10-25,21:00,22:00,Court 6,OPEN_PLAY,ALL_LEVELS,3,8,12,"James Wilson; Tom Rivera; Jake Rodriguez"
2025-10-26,07:30,09:00,Court 3,SOCIAL,ALL_LEVELS,3,8,10,"David Brown; Julian Peterson; Tom Rivera"
2025-10-26,10:30,12:00,Court 6,CLINIC,INTERMEDIATE,8,16,20,"David Brown; Emma Johnson; Owen Adams; Aria Long; Isabella Clark"
2025-10-26,12:00,13:30,Court 4,LEAGUE_PLAY,ADVANCED,2,4,35,"Alex Rivera; Sophie Taylor"
2025-10-26,16:30,18:00,Court 3,DRILL,ALL_LEVELS,5,6,15,"Emily Hill; Liam Nelson; Anna Garcia; Layla Campbell; Aiden Thomas"
2025-10-26,18:00,19:30,Court 4,SOCIAL,ALL_LEVELS,8,8,15,"Lisa Park; David Brown; Scarlett Baker; Sophie Taylor; Harper Jackson; Kelly Wright"
2025-10-26,19:30,21:00,Court 2,DRILL,ALL_LEVELS,4,6,20,"Isabella Clark; Priya Sharma"
2025-10-27,06:00,07:30,Court 2,OPEN_PLAY,ALL_LEVELS,2,8,15,"David Brown; James Wilson"
2025-10-27,07:30,09:00,Court 5,OPEN_PLAY,ALL_LEVELS,3,8,18,"Emma Johnson; Caleb King; Priya Sharma"
2025-10-27,09:00,10:30,Court 5,DRILL,ALL_LEVELS,3,6,15,"Mark Johnson; Evelyn Martinez; Priya Sharma"
2025-10-27,10:30,12:00,Court 2,LEAGUE_PLAY,INTERMEDIATE,2,4,40,"Willow Diaz; Liam Nelson"
2025-10-27,13:30,15:00,Court 3,SOCIAL,ALL_LEVELS,6,16,15,"Jake Rodriguez; Isabella Clark; Lisa Park"
2025-10-27,15:00,16:30,Court 2,OPEN_PLAY,ALL_LEVELS,7,12,15,"Rachel Kim; David Brown; Sarah Mitchell; Riley Stewart; Priya Sharma; Nina Lopez; Bella Bennett"
2025-10-27,16:30,18:00,Court 2,SOCIAL,ALL_LEVELS,5,8,10,"James Wilson; Addison Howard; Rachel Kim; Chris Taylor; Jennifer Liu"
2025-10-27,18:00,19:30,Court 4,LEAGUE_PLAY,INTERMEDIATE,3,4,40,"Maria Santos; Priya Sharma"
2025-10-27,19:30,21:00,Court 6,SOCIAL,ALL_LEVELS,7,8,15,"Caleb King; Sophia Lee; Kevin Lee; Grace Hall; Sam Roberts"
2025-10-28,09:00,10:30,Court 5,OPEN_PLAY,ALL_LEVELS,6,12,18,"Rachel Kim; Hazel Fisher; Emma Johnson; Mike Chen; Sophie Taylor"
2025-10-28,10:30,12:00,Court 6,DRILL,ALL_LEVELS,4,8,20,"Asher Sullivan; Rachel Kim; Carter Thompson; Mateo Cruz"
2025-10-28,13:30,15:00,Court 4,OPEN_PLAY,ALL_LEVELS,4,12,15,"Victoria Hernandez; Sophie Taylor; Sophia Lee; Anna Garcia"
2025-10-28,15:00,16:30,Court 4,CLINIC,INTERMEDIATE,5,12,30,"Lisa Park; Mark Johnson; Mike Chen"
2025-10-28,16:30,18:00,Court 3,SOCIAL,ALL_LEVELS,8,16,15,"Kevin Lee; Sam Roberts; Emily Hill; Stella Gray; Liam Nelson"
2025-10-28,18:00,19:30,Court 4,DRILL,ALL_LEVELS,4,6,18,"Sarah Mitchell; Alex Rivera; Josiah Ramirez"
2025-10-28,21:00,22:00,Court 4,SOCIAL,ALL_LEVELS,5,16,10,"James Wilson; Jaxon Ross; Lisa Park; Ava White; Sophie Taylor"
2025-10-29,06:00,07:30,Court 2,OPEN_PLAY,ALL_LEVELS,2,12,12,"Savannah Sanders; Sophie Taylor"
2025-10-29,09:00,10:30,Court 6,CLINIC,INTERMEDIATE,7,16,30,"Nina Lopez; Priya Sharma; Maria Santos; Ethan Moore; Alex Rivera; Wyatt Young"
2025-10-29,10:30,12:00,Court 2,CLINIC,INTERMEDIATE,7,16,25,"Mark Johnson; Priya Sharma; Chloe Allen; Megan Scott; Sebastian Wright; Rachel Kim"
2025-10-29,13:30,15:00,Court 3,OPEN_PLAY,ALL_LEVELS,4,12,18,"Caleb King; Logan Garcia; Emma Johnson; Chris Taylor"
2025-10-29,16:30,18:00,Court 1,SOCIAL,ALL_LEVELS,5,8,15,"Chris Taylor; Caleb King; Diana Park"
2025-10-29,18:00,19:30,Court 5,SOCIAL,ALL_LEVELS,6,8,15,"Rachel Kim; Sebastian Wright; Eleanor Ward"
2025-10-29,19:30,21:00,Court 3,CLINIC,BEGINNER,9,16,30,"Elijah Anderson; Alex Rivera; Megan Scott; Liam Nelson; Hannah Rivera"
2025-10-30,06:00,07:30,Court 6,DRILL,ALL_LEVELS,2,8,18,"Lucas Martin; Anna Garcia"
2025-10-30,07:30,09:00,Court 2,SOCIAL,ALL_LEVELS,4,16,15,"Liam Nelson; Mike Chen; Levi Mitchell; Sam Roberts"
2025-10-30,09:00,10:30,Court 1,CLINIC,BEGINNER,11,16,20,"Victoria Hernandez; Caleb King; Sebastian Wright; Tom Rivera"
2025-10-30,10:30,12:00,Court 5,SOCIAL,ALL_LEVELS,9,16,10,"Ava White; Sophie Taylor; Amelia Wilson"
2025-10-30,12:00,13:30,Court 2,LEAGUE_PLAY,ADVANCED,1,4,50,"Joshua Ross"
2025-10-30,15:00,16:30,Court 6,DRILL,ALL_LEVELS,3,6,18,"Paisley Barnes; Alex Rivera; Mike Chen"
2025-10-30,16:30,18:00,Court 2,CLINIC,BEGINNER,11,16,20,"Jack Scott; Kelly Wright; Maria Santos; Anna Garcia; Alex Rivera; Layla Campbell"
2025-10-31,07:30,09:00,Court 2,DRILL,ALL_LEVELS,4,8,15,"Ryan Foster; Maria Santos; Kevin Lee"
2025-10-31,09:00,10:30,Court 3,DRILL,ALL_LEVELS,3,6,20,"Anna Garcia; Lisa Park; Addison Howard"
2025-10-31,10:30,12:00,Court 6,CLINIC,BEGINNER,4,8,20,"James Wilson; Charlotte Davis; Jennifer Liu; Lisa Park"
2025-10-31,13:30,15:00,Court 2,OPEN_PLAY,ALL_LEVELS,4,12,18,"Caleb King; Sarah Mitchell; Tom Rivera; Kevin Lee"
2025-11-01,07:30,09:00,Court 6,SOCIAL,ALL_LEVELS,2,8,10,"Anna Garcia; Chloe Allen"
2025-11-01,10:30,12:00,Court 6,CLINIC,BEGINNER,4,8,20,"Logan Garcia; Tom Rivera; Henry Nelson"
2025-11-01,12:00,13:30,Court 5,CLINIC,INTERMEDIATE,3,8,25,"Sarah Mitchell; Chris Taylor; Kelly Wright"
2025-11-01,13:30,15:00,Court 1,SOCIAL,ALL_LEVELS,4,16,15,"Joshua Ross; Gabriel Cook; Anna Garcia; Ryan Foster"
2025-11-01,15:00,16:30,Court 5,OPEN_PLAY,ALL_LEVELS,4,12,18,"Priya Sharma; Kelly Wright; Aiden Thomas; Scarlett Baker"
2025-11-01,16:30,18:00,Court 6,OPEN_PLAY,ALL_LEVELS,10,12,12,"Kelly Wright; Grace Hall; Gabriel Cook"
2025-11-02,06:00,07:30,Court 1,SOCIAL,ALL_LEVELS,2,8,10,"Amelia Wilson; Logan Garcia"
2025-11-02,07:30,09:00,Court 5,OPEN_PLAY,ALL_LEVELS,2,8,15,"Noah Harris; Tom Rivera"
2025-11-02,09:00,10:30,Court 4,CLINIC,INTERMEDIATE,4,8,25,"Alex Rivera; Noah Harris; Mark Johnson; Maria Santos"
2025-11-02,10:30,12:00,Court 3,DRILL,ALL_LEVELS,3,6,20,"Mike Chen; Tom Rivera; Nina Lopez"
2025-11-02,12:00,13:30,Court 5,CLINIC,BEGINNER,4,12,20,"Rachel Kim; Tom Rivera; Kelly Wright; Jake Rodriguez"
2025-11-02,13:30,15:00,Court 1,OPEN_PLAY,ALL_LEVELS,4,12,15,"Rachel Kim; Emily Hill; Priya Sharma"
2025-11-02,16:30,18:00,Court 3,SOCIAL,ALL_LEVELS,13,16,10,"Stella Gray; Harper Jackson; Owen Adams; James Wilson"
2025-11-02,19:30,21:00,Court 3,LEAGUE_PLAY,INTERMEDIATE,2,4,50,"Ethan Moore; Victoria Hernandez"
2025-11-02,21:00,22:00,Court 1,SOCIAL,ALL_LEVELS,6,16,15,"Jennifer Liu; Chloe Allen; Mark Johnson; Jack Scott; Liam Nelson; Priya Sharma"
2025-11-03,06:00,07:30,Court 6,OPEN_PLAY,ALL_LEVELS,2,8,15,"Elijah Anderson; Addison Howard"
2025-11-03,07:30,09:00,Court 1,DRILL,ALL_LEVELS,3,6,15,"Rachel Kim; Jaxon Ross"
2025-11-03,10:30,12:00,Court 2,CLINIC,BEGINNER,5,8,30,"Julian Peterson; Amelia Wilson; Anna Garcia; David Brown"
2025-11-03,13:30,15:00,Court 4,OPEN_PLAY,ALL_LEVELS,3,8,18,"Carter Thompson; Tom Rivera; Owen Adams"
2025-11-03,15:00,16:30,Court 2,CLINIC,BEGINNER,7,16,20,"Stella Gray; Leah Foster; Skylar Edwards; Maya Collins; Claire Barnes; Julian Peterson; Christopher Perry"
2025-11-03,16:30,18:00,Court 5,DRILL,ALL_LEVELS,6,8,18,"Lisa Park; Amelia Wilson; Ella Green; Emma Johnson; Rachel Kim; Addison Howard"
2025-11-03,18:00,19:30,Court 2,DRILL,ALL_LEVELS,7,8,18,"Hazel Fisher; Chris Taylor; Emma Johnson; Nora Morgan"
2025-11-03,21:00,22:00,Court 5,CLINIC,INTERMEDIATE,3,8,20,"Harper Jackson; Olivia Turner; Layla Campbell"
2025-11-04,07:30,09:00,Court 5,OPEN_PLAY,ALL_LEVELS,3,8,18,"Mike Chen; Sebastian Wright; Rachel Kim"
2025-11-04,09:00,10:30,Court 6,OPEN_PLAY,ALL_LEVELS,6,12,12,"Audrey Evans; Rachel Kim; Brooklyn Murphy; Colton Wood; Cameron Howard"
2025-11-04,12:00,13:30,Court 1,DRILL,ALL_LEVELS,2,6,20,"Jack Scott; Mason Brown"
2025-11-04,13:30,15:00,Court 1,CLINIC,INTERMEDIATE,3,12,20,"Lily Murphy; Ruby Bryant; Charlotte Davis"
2025-11-04,16:30,18:00,Court 3,OPEN_PLAY,ALL_LEVELS,5,8,18,"Chris Taylor; Maria Santos; Liam Nelson; Lucas Martin; Sam Roberts"
2025-11-05,06:00,07:30,Court 2,OPEN_PLAY,ALL_LEVELS,2,12,12,"Henry Nelson; Kevin Lee"
2025-11-05,07:30,09:00,Court 1,OPEN_PLAY,ALL_LEVELS,4,12,18,"Jake Rodriguez; Sophie Taylor; Priya Sharma"
2025-11-05,09:00,10:30,Court 1,CLINIC,INTERMEDIATE,7,16,25,"Alice Fisher; Priya Sharma; Anna Garcia; Rachel Kim"
2025-11-05,10:30,12:00,Court 2,SOCIAL,ALL_LEVELS,8,16,10,"Josiah Ramirez; Sophie Taylor; Maria Santos; Jack Scott; Kevin Lee; Joshua Ross; Priya Sharma; Stella Gray"
2025-11-05,13:30,15:00,Court 3,OPEN_PLAY,ALL_LEVELS,4,12,15,"Kevin Lee; Elijah Anderson; Sarah Mitchell; Owen Adams"
2025-11-06,06:00,07:30,Court 6,OPEN_PLAY,ALL_LEVELS,3,12,18,"Rachel Kim; Samuel Cox; Chris Taylor"
2025-11-06,10:30,12:00,Court 5,SOCIAL,ALL_LEVELS,4,8,15,"Caleb King; Henry Nelson"
2025-11-06,12:00,13:30,Court 6,CLINIC,INTERMEDIATE,2,8,30,"Emma Johnson; Nina Lopez"
2025-11-06,13:30,15:00,Court 6,SOCIAL,ALL_LEVELS,4,16,15,"David Brown; Aiden Thomas; Maria Santos; Lucas Martin"
2025-11-06,16:30,18:00,Court 1,CLINIC,INTERMEDIATE,4,8,20,"Zoey Reed; Tom Rivera; Bella Bennett; Christopher Perry"
2025-11-06,19:30,21:00,Court 4,OPEN_PLAY,ALL_LEVELS,7,12,15,"Chris Taylor; Ryan Foster; Jennifer Liu; Henry Nelson; James Wilson; Josiah Ramirez"
2025-11-06,21:00,22:00,Court 5,OPEN_PLAY,ALL_LEVELS,2,8,15,"Kevin Lee; Ryan Foster"
2025-11-07,06:00,07:30,Court 1,CLINIC,INTERMEDIATE,4,16,25,"Rachel Kim; Mateo Cruz; Anna Garcia; Emily Hill"
2025-11-07,07:30,09:00,Court 6,OPEN_PLAY,ALL_LEVELS,4,12,12,"Wyatt Young; Megan Scott; Ruby Bryant; Abigail Robinson"
2025-11-07,09:00,10:30,Court 6,SOCIAL,ALL_LEVELS,8,16,10,"Lucas Martin; Ethan Moore; Carter Thompson; Aiden Thomas; Isabella Clark; James Wilson"
2025-11-07,12:00,13:30,Court 1,OPEN_PLAY,ALL_LEVELS,4,12,12,"Priya Sharma; Maria Santos; Miles Collins; Noah Harris"
2025-11-08,06:00,07:30,Court 5,OPEN_PLAY,ALL_LEVELS,2,8,18,"Maria Santos; Tom Rivera"
2025-11-08,09:00,10:30,Court 4,LEAGUE_PLAY,INTERMEDIATE,2,4,40,"David Brown; Carter Thompson"
2025-11-08,13:30,15:00,Court 2,CLINIC,BEGINNER,5,16,30,"Emma Johnson; Tom Rivera; Jack Scott; Sarah Mitchell"
2025-11-08,15:00,16:30,Court 1,SOCIAL,ALL_LEVELS,6,16,15,"Chloe Allen; Noah Harris; Sam Roberts; Mike Chen; Joshua Ross; Chris Taylor"
2025-11-09,07:30,09:00,Court 3,CLINIC,BEGINNER,5,16,20,"Harper Jackson; Chloe Allen; Layla Campbell; Bella Bennett; Abigail Robinson"
2025-11-09,10:30,12:00,Court 4,SOCIAL,ALL_LEVELS,5,8,15,"Owen Adams; Kevin Lee; Sam Roberts; Joshua Ross; Anna Garcia"
2025-11-09,12:00,13:30,Court 5,OPEN_PLAY,ALL_LEVELS,5,12,18,"David Brown; Mike Chen; Nina Lopez; Scarlett Baker; Lisa Park"
2025-11-09,13:30,15:00,Court 6,LEAGUE_PLAY,INTERMEDIATE,1,4,35,"Elijah Anderson"
2025-11-09,16:30,18:00,Court 4,CLINIC,INTERMEDIATE,6,8,20,"James Wilson; Emma Johnson; Mason Brown; Megan Scott; Rachel Kim; Daniel Rogers"
2025-11-09,18:00,19:30,Court 5,LEAGUE_PLAY,INTERMEDIATE,3,4,35,"Abigail Robinson; Penelope Lewis; Diana Park"
2025-11-09,21:00,22:00,Court 3,DRILL,ALL_LEVELS,2,6,18,"Maria Santos; Chris Taylor"
2025-11-10,07:30,09:00,Court 1,CLINIC,BEGINNER,3,8,30,"Kevin Lee; Mike Chen; Victoria Hernandez"
2025-11-10,12:00,13:30,Court 3,OPEN_PLAY,ALL_LEVELS,3,8,18,"Lisa Park; Jayden Ward; Ethan Moore"
2025-11-10,13:30,15:00,Court 6,OPEN_PLAY,ALL_LEVELS,3,8,12,"Emily Hill; Sebastian Wright; Tom Rivera"
2025-11-10,16:30,18:00,Court 3,SOCIAL,ALL_LEVELS,6,8,10,"Sophie Taylor; Emma Johnson; David Brown; Megan Scott; Henry Nelson; Mike Chen"
2025-11-10,18:00,19:30,Court 6,OPEN_PLAY,ALL_LEVELS,10,12,12,"Emma Johnson; Ryan Foster; Kevin Lee; Anna Garcia; Lisa Park"
2025-11-10,19:30,21:00,Court 4,SOCIAL,ALL_LEVELS,5,8,10,"Tom Rivera; Diana Park; Matthew Bell; Victoria Hernandez; Olivia Turner"
2025-11-10,21:00,22:00,Court 5,SOCIAL,ALL_LEVELS,2,8,15,"Mike Chen; Logan Garcia"
2025-11-11,07:30,09:00,Court 6,SOCIAL,ALL_LEVELS,6,16,10,"Logan Garcia; Rachel Kim; Lisa Park; Mike Chen; Priya Sharma; Alex Rivera"
2025-11-11,09:00,10:30,Court 1,SOCIAL,ALL_LEVELS,4,8,15,"Anna Garcia; Abigail Robinson; Kelly Wright; Grace Hall"
2025-11-11,12:00,13:30,Court 5,OPEN_PLAY,ALL_LEVELS,2,8,12,"Owen Adams; Sam Roberts"
2025-11-11,13:30,15:00,Court 5,OPEN_PLAY,ALL_LEVELS,2,8,12,"Julian Peterson; James Wilson"
2025-11-11,15:00,16:30,Court 4,CLINIC,INTERMEDIATE,5,16,25,"Chris Taylor; Jeremiah Morgan; Mark Johnson; Kevin Lee"
2025-11-11,16:30,18:00,Court 1,SOCIAL,ALL_LEVELS,11,16,15,"Priya Sharma; Maria Santos; Henry Nelson"
2025-11-11,18:00,19:30,Court 6,OPEN_PLAY,ALL_LEVELS,6,8,18,"Megan Scott; Chloe Allen; Tom Rivera; Carter Thompson; Abigail Robinson; Harper Jackson"
2025-11-12,06:00,07:30,Court 4,OPEN_PLAY,ALL_LEVELS,2,8,12,"Grace Hall; Mark Johnson"
2025-11-12,07:30,09:00,Court 2,LEAGUE_PLAY,ADVANCED,1,4,50,"Anna Garcia"
2025-11-12,09:00,10:30,Court 6,OPEN_PLAY,ALL_LEVELS,4,8,15,"Anna Garcia; Grace Hall; Amelia Wilson; Lisa Park"
2025-11-12,15:00,16:30,Court 1,OPEN_PLAY,ALL_LEVELS,3,8,12,"Sophie Taylor; Mike Chen; Ethan Moore"
2025-11-12,16:30,18:00,Court 4,OPEN_PLAY,ALL_LEVELS,7,12,18,"Jack Scott; Abigail Robinson; Jackson Bailey; Carter Thompson; Sam Roberts"
2025-11-12,18:00,19:30,Court 1,OPEN_PLAY,ALL_LEVELS,7,12,15,"Rachel Kim; Jake Rodriguez; James Wilson; Colton Wood; Emma Johnson; Sebastian Wright"
2025-11-13,06:00,07:30,Court 5,OPEN_PLAY,ALL_LEVELS,1,8,12,"Kevin Lee"
2025-11-13,10:30,12:00,Court 4,CLINIC,INTERMEDIATE,6,12,30,"Owen Adams; Ava White"
2025-11-13,12:00,13:30,Court 6,OPEN_PLAY,ALL_LEVELS,4,12,18,"Sarah Mitchell; Tom Rivera; Lucas Martin; Liam Nelson"
2025-11-13,13:30,15:00,Court 3,OPEN_PLAY,ALL_LEVELS,3,12,12,"David Brown; Alex Rivera; Emilia Washington"
2025-11-13,15:00,16:30,Court 2,LEAGUE_PLAY,INTERMEDIATE,2,4,35,"Ava White; Isabella Clark"
2025-11-13,16:30,18:00,Court 2,OPEN_PLAY,ALL_LEVELS,7,12,12,"Aiden Thomas; Kevin Lee; James Wilson; Sophia Lee; Sebastian Wright"
2025-11-13,19:30,21:00,Court 6,OPEN_PLAY,ALL_LEVELS,4,8,18,"Chris Taylor; Sam Roberts; Scarlett Baker; Sophie Taylor"
2025-11-14,06:00,07:30,Court 3,OPEN_PLAY,ALL_LEVELS,2,12,12,"Sarah Mitchell; Owen Adams"
2025-11-14,12:00,13:30,Court 1,OPEN_PLAY,ALL_LEVELS,4,12,12,"Emily Hill; Maria Santos; Brandon Hall; Ella Green"
2025-11-14,13:30,15:00,Court 3,SOCIAL,ALL_LEVELS,4,16,15,"Priya Sharma; Caleb King; Noah Harris; Mark Johnson"
2025-11-14,15:00,16:30,Court 4,SOCIAL,ALL_LEVELS,7,16,10,"Sarah Mitchell; Brandon Hall; Nora Morgan; Aurora Torres; Ezra Griffin; Lucas Martin; Rachel Kim"
