date,startTime,endTime,court,format,skillLevel,registered,capacity,pricePerPlayer,playerNames
2025-07-07,15:00,16:30,Court 5,DRILL,ALL_LEVELS,4,6,15,"James Wilson; Lisa Park; Anna Garcia; Priya Sharma"
2025-07-07,16:30,18:00,Court 2,SOCIAL,ALL_LEVELS,8,8,10,"Anna Garcia; Addison Howard; Tom Rivera; Emily Hill; Megan Scott; Aiden Thomas; Jayden Ward; Sophia Lee"
2025-07-07,18:00,19:30,Court 3,CLINIC,BEGINNER,8,8,30,"Mike Chen; Lisa Park; Tom Rivera"
2025-07-07,19:30,21:00,Court 3,OPEN_PLAY,ALL_LEVELS,12,12,18,"Priya Sharma; Chris Taylor; Rachel Kim; Emma Johnson"
2025-07-07,21:00,22:00,Court 3,CLINIC,INTERMEDIATE,8,16,25,"Chris Taylor; Sophie Taylor; Grace Hall; Megan Scott"
2025-07-08,07:30,09:00,Court 3,OPEN_PLAY,ALL_LEVELS,5,12,15,"Anna Garcia; Ruby Bryant; Priya Sharma; David Brown; Chris Taylor"
2025-07-08,10:30,12:00,Court 4,OPEN_PLAY,ALL_LEVELS,7,12,12,"Olivia Turner; Nora Morgan; Jennifer Liu; Sophia Lee; Ella Green; Sophie Taylor; Maria Santos"
2025-07-08,12:00,13:30,Court 2,OPEN_PLAY,ALL_LEVELS,3,8,18,"Olivia Turner; Eleanor Ward; Brandon Hall"
2025-07-08,15:00,16:30,Court 3,OPEN_PLAY,ALL_LEVELS,5,8,15,"David Brown"
2025-07-08,16:30,18:00,Court 6,OPEN_PLAY,ALL_LEVELS,12,12,12,"Gabriel Cook; Mike Chen; Liam Nelson; Ella Green"
2025-07-08,18:00,19:30,Court 6,DRILL,ALL_LEVELS,8,8,15,"Sebastian Wright; Abigail Robinson; Evelyn Martinez; Ava White; Emily Hill; Olivia Turner; Ryan Foster; Tom Rivera"
2025-07-08,19:30,21:00,Court 2,LEAGUE_PLAY,ADVANCED,3,4,50,"Luke Hayes; Sebastian Wright; Kevin Lee"
2025-07-09,06:00,07:30,Court 5,CLINIC,BEGINNER,3,12,20,"Wyatt Young; Sophie Taylor; Anna Garcia"
2025-07-09,07:30,09:00,Court 2,OPEN_PLAY,ALL_LEVELS,6,12,18,"Sophia Lee; Mike Chen; Tom Rivera; Anna Garcia; Chris Taylor"
2025-07-09,10:30,12:00,Court 5,OPEN_PLAY,ALL_LEVELS,7,12,15,"Sarah Mitchell; Brandon Hall; Wyatt Young; James Wilson; Lisa Park; Kevin Lee; Chris Taylor"
2025-07-09,12:00,13:30,Court 4,OPEN_PLAY,ALL_LEVELS,3,8,12,"James Wilson; Anna Garcia; Mike Chen"
2025-07-09,13:30,15:00,Court 1,CLINIC,INTERMEDIATE,5,16,20,"Priya Sharma; James Wilson; Henry Nelson; Jennifer Liu; Mateo Cruz"
2025-07-10,06:00,07:30,Court 3,SOCIAL,ALL_LEVELS,4,16,10,"Maria Santos; Anna Garcia; Nora Morgan; Benjamin Walker"
2025-07-10,07:30,09:00,Court 1,OPEN_PLAY,ALL_LEVELS,4,8,12,"Daniel Rogers; Victoria Hernandez; Noah Harris; Mike Chen"
2025-07-10,09:00,10:30,Court 1,SOCIAL,ALL_LEVELS,6,8,15,"Maria Santos; Tom Rivera; Brandon Hall; Megan Scott; Grace Hall; Henry Nelson"
2025-07-10,13:30,15:00,Court 3,CLINIC,INTERMEDIATE,4,12,20,"Harper Jackson; Olivia Turner; Emma Johnson; Anna Garcia"
2025-07-10,15:00,16:30,Court 5,SOCIAL,ALL_LEVELS,10,16,10,"Isabella Clark; Anna Garcia; Tom Rivera; Colton Wood; Nora Morgan; Olivia Turner; James Wilson; Rachel Kim; Mike Chen"
2025-07-11,07:30,09:00,Court 2,LEAGUE_PLAY,INTERMEDIATE,2,4,50,"David Brown; Mike Chen"
2025-07-11,09:00,10:30,Court 2,OPEN_PLAY,ALL_LEVELS,7,12,12,"Lincoln Price; Anna Garcia; Mike Chen; Evelyn Martinez; Abigail Robinson"
2025-07-11,10:30,12:00,Court 5,LEAGUE_PLAY,ADVANCED,3,4,50,"Leo Robinson; Lucas Martin; Lisa Park"
2025-07-11,15:00,16:30,Court 4,CLINIC,BEGINNER,11,16,20,"Maria Santos; Ruby Bryant; Emma Johnson; Theodore Wood; Mark Johnson; Alex Rivera"
2025-07-11,16:30,18:00,Court 4,LEAGUE_PLAY,INTERMEDIATE,4,4,40,"Mason Brown; Chris Taylor; Ryan Foster"
2025-07-12,06:00,07:30,Court 2,DRILL,ALL_LEVELS,1,6,15,"Benjamin Walker"
2025-07-12,07:30,09:00,Court 3,OPEN_PLAY,ALL_LEVELS,4,12,15,"Mila Jenkins; Sarah Mitchell; Ethan Moore; Emily Hill"
2025-07-12,09:00,10:30,Court 3,SOCIAL,ALL_LEVELS,7,8,15,"Henry Nelson; Zoey Reed"
2025-07-12,10:30,12:00,Court 5,DRILL,ALL_LEVELS,5,8,15,"Chris Taylor; Ethan Moore; Maria Santos; Grace Hall; Olivia Turner"
2025-07-12,12:00,13:30,Court 4,SOCIAL,ALL_LEVELS,7,16,15,"Liam Nelson; Lisa Park; Mila Jenkins; Tom Rivera; Maria Santos; Kevin Lee"
2025-07-13,06:00,07:30,Court 2,SOCIAL,ALL_LEVELS,3,8,15,"Anna Garcia; Priya Sharma; Brandon Hall"
2025-07-13,10:30,12:00,Court 6,SOCIAL,ALL_LEVELS,12,16,10,"Maria Santos; Sarah Mitchell; Aurora Torres; Priya Sharma"
2025-07-13,12:00,13:30,Court 4,SOCIAL,ALL_LEVELS,5,8,15,"Rachel Kim; Owen Adams; Joshua Ross; Samuel Cox; Harper Jackson"
2025-07-13,13:30,15:00,Court 1,SOCIAL,ALL_LEVELS,7,16,10,"Rachel Kim; Chris Taylor; Skylar Edwards; Alex Rivera; Maria Santos; Noah Harris; Tom Rivera"
2025-07-13,15:00,16:30,Court 2,LEAGUE_PLAY,INTERMEDIATE,2,4,50,"Jennifer Liu; Nova Hughes"
2025-07-13,18:00,19:30,Court 6,OPEN_PLAY,ALL_LEVELS,12,12,12,"Sophie Taylor; Rachel Kim; Logan Garcia; Jennifer Liu; Diana Park; Zoey Reed; James Wilson; Abigail Robinson"
2025-07-13,19:30,21:00,Court 3,SOCIAL,ALL_LEVELS,14,16,15,"Jack Scott; Chris Taylor; Sarah Mitchell; Megan Scott; Henry Nelson"
2025-07-13,21:00,22:00,Court 3,SOCIAL,ALL_LEVELS,4,8,10,"Ava White; Anna Garcia; Colton Wood; Chloe Allen"
2025-07-14,06:00,07:30,Court 3,OPEN_PLAY,ALL_LEVELS,5,12,12,"Lisa Park; Jayden Ward; Kelly Wright"
2025-07-14,07:30,09:00,Court 2,SOCIAL,ALL_LEVELS,10,16,10,"Chris Taylor; Henry Nelson; Nina Lopez; Maya Collins; Benjamin Walker"
2025-07-14,10:30,12:00,Court 3,CLINIC,BEGINNER,7,8,25,"Anna Garcia; Kevin Lee; Priya Sharma; Emma Johnson; Maria Santos; Scarlett Baker"
2025-07-14,13:30,15:00,Court 1,LEAGUE_PLAY,ADVANCED,2,4,50,"Alex Rivera; Maria Santos"
2025-07-14,18:00,19:30,Court 6,LEAGUE_PLAY,ADVANCED,4,4,40,"Maria Santos; Aurora Torres; David Brown; Owen Adams"
2025-07-14,21:00,22:00,Court 5,OPEN_PLAY,ALL_LEVELS,5,12,15,"Aiden Thomas; Lily Murphy; Tom Rivera"
2025-07-15,06:00,07:30,Court 2,CLINIC,INTERMEDIATE,3,12,30,"Jack Scott; Emma Johnson; Henry Nelson"
2025-07-15,07:30,09:00,Court 2,CLINIC,BEGINNER,7,12,30,"Alex Rivera; Mila Jenkins; Penelope Lewis; James Wilson; Sarah Mitchell; Leo Robinson; Jake Rodriguez"
2025-07-15,09:00,10:30,Court 6,SOCIAL,ALL_LEVELS,10,16,15,"Maria Santos; Elijah Anderson; Lily Murphy; Chloe Allen; Ella Green; Caleb King"
2025-07-15,10:30,12:00,Court 4,SOCIAL,ALL_LEVELS,8,16,10,"Charlotte Davis; Anna Garcia; Penelope Lewis; Chris Taylor; Amelia Wilson; Diana Park"
2025-07-15,12:00,13:30,Court 3,OPEN_PLAY,ALL_LEVELS,5,8,12,"Bella Bennett; Emma Johnson; Tom Rivera; Noah Harris; Diana Park"
2025-07-15,13:30,15:00,Court 6,OPEN_PLAY,ALL_LEVELS,4,12,18,"Jake Rodriguez; Victoria Hernandez; Robert Ross; Natalie Gray"
2025-07-15,18:00,19:30,Court 2,SOCIAL,ALL_LEVELS,8,8,15,"Sarah Mitchell; Sophie Taylor; Henry Nelson; Mike Chen; Lisa Park"
2025-07-15,19:30,21:00,Court 3,DRILL,ALL_LEVELS,5,8,20,"Charlotte Davis; Emma Johnson; Mason Brown; Caleb King; Ethan Moore"
2025-07-15,21:00,22:00,Court 4,LEAGUE_PLAY,INTERMEDIATE,1,4,50,"Riley Stewart"
2025-07-16,06:00,07:30,Court 5,SOCIAL,ALL_LEVELS,4,16,15,"Jack Scott; Nina Lopez; Joshua Ross; Priya Sharma"
2025-07-16,09:00,10:30,Court 3,CLINIC,INTERMEDIATE,7,8,30,"Maria Santos; Sarah Mitchell; Kinsley Bennett; Jake Rodriguez; Rachel Kim; Lisa Park"
2025-07-16,10:30,12:00,Court 4,CLINIC,BEGINNER,13,16,25,"Ellie Russell; Henry Nelson; Daniel Rogers; Chris Taylor; Olivia Turner"
2025-07-16,12:00,13:30,Court 6,OPEN_PLAY,ALL_LEVELS,6,12,18,"Anna Garcia; Charlotte Davis"
2025-07-16,15:00,16:30,Court 2,DRILL,ALL_LEVELS,3,6,20,"Sophie Taylor; David Brown; Rachel Kim"
2025-07-16,16:30,18:00,Court 2,CLINIC,INTERMEDIATE,7,8,25,"Ella Green; Benjamin Walker; Chris Taylor; Kelly Wright"
2025-07-16,18:00,19:30,Court 5,DRILL,ALL_LEVELS,5,6,18,"Rachel Kim; Chris Taylor; Chloe Allen; Anna Garcia"
2025-07-16,19:30,21:00,Court 4,SOCIAL,ALL_LEVELS,6,8,10,"Sophia Lee; Alex Rivera; Charlotte Davis; Amelia Wilson; Liam Nelson"
2025-07-16,21:00,22:00,Court 1,OPEN_PLAY,ALL_LEVELS,4,12,12,"Nina Lopez; Carter Thompson; Mason Brown; David Brown"
2025-07-17,06:00,07:30,Court 5,LEAGUE_PLAY,ADVANCED,1,4,50,"Kevin Lee"
2025-07-17,07:30,09:00,Court 2,OPEN_PLAY,ALL_LEVELS,6,12,15,"Diana Park; Sophie Taylor; Sam Roberts; Nina Lopez"
2025-07-17,09:00,10:30,Court 6,OPEN_PLAY,ALL_LEVELS,5,8,15,"Ethan Moore; Priya Sharma; Kevin Lee; Anna Garcia; Mark Johnson"
2025-07-17,12:00,13:30,Court 1,OPEN_PLAY,ALL_LEVELS,5,12,18,"Abigail Robinson; Nova Hughes; Hazel Fisher; Christopher Perry"
2025-07-17,13:30,15:00,Court 2,DRILL,ALL_LEVELS,3,8,15,"Ella Green; Aiden Thomas; Henry Nelson"
2025-07-17,15:00,16:30,Court 6,LEAGUE_PLAY,ADVANCED,2,4,40,"Eli Torres; Mason Brown"
2025-07-17,16:30,18:00,Court 5,SOCIAL,ALL_LEVELS,5,8,15,"Brandon Hall; Isaiah Coleman; Sophie Taylor; Tom Rivera"
2025-07-18,07:30,09:00,Court 6,OPEN_PLAY,ALL_LEVELS,3,8,15,"Maria Santos; Jennifer Liu; David Brown"
2025-07-18,15:00,16:30,Court 5,OPEN_PLAY,ALL_LEVELS,4,8,12,"Charlotte Davis; Emma Johnson; Mike Chen; Scarlett Baker"
2025-07-18,18:00,19:30,Court 1,OPEN_PLAY,ALL_LEVELS,11,12,12,"Willow Diaz; Leo Robinson; Charlotte Davis; Ella Green; Alex Rivera"
2025-07-18,19:30,21:00,Court 6,OPEN_PLAY,ALL_LEVELS,7,8,15,"Megan Scott; Josiah Ramirez; Jack Scott; Ryan Foster; Samuel Cox; Lucas Martin"
2025-07-18,21:00,22:00,Court 3,DRILL,ALL_LEVELS,2,6,15,"Owen Adams; Megan Scott"
2025-07-19,06:00,07:30,Court 3,OPEN_PLAY,ALL_LEVELS,3,12,15,"Chris Taylor; Logan Garcia"
2025-07-19,09:00,10:30,Court 4,OPEN_PLAY,ALL_LEVELS,7,8,15,"Layla Campbell; Evelyn Martinez; Jennifer Liu; Liam Nelson; Kevin Lee"
2025-07-19,10:30,12:00,Court 1,OPEN_PLAY,ALL_LEVELS,9,12,15,"Alex Rivera; Chris Taylor; Sarah Mitchell; Mason Brown"
2025-07-19,12:00,13:30,Court 2,DRILL,ALL_LEVELS,3,6,20,"Ava White"
2025-07-19,13:30,15:00,Court 3,OPEN_PLAY,ALL_LEVELS,2,8,18,"Emma Johnson; Rachel Kim"
2025-07-19,15:00,16:30,Court 2,LEAGUE_PLAY,ADVANCED,2,4,50,"Mason Brown; Mike Chen"
2025-07-19,16:30,18:00,Court 5,SOCIAL,ALL_LEVELS,14,16,15,"Liam Nelson; Owen Adams"
2025-07-19,18:00,19:30,Court 4,SOCIAL,ALL_LEVELS,13,16,10,"Abigail Robinson; Sarah Mitchell; Ava White; Logan Garcia; Skylar Edwards; Naomi Barnes; Caleb King; Sam Roberts"
2025-07-19,19:30,21:00,Court 1,OPEN_PLAY,ALL_LEVELS,6,8,18,"Jayden Ward; Ella Green; Liam Nelson; Savannah Sanders; Victoria Hernandez; Wyatt Young"
2025-07-19,21:00,22:00,Court 3,OPEN_PLAY,ALL_LEVELS,4,12,15,"Tom Rivera; Carter Thompson; David Brown; Chris Taylor"
2025-07-20,06:00,07:30,Court 2,OPEN_PLAY,ALL_LEVELS,3,8,18,"Chris Taylor; Lisa Park; Hazel Fisher"
2025-07-20,07:30,09:00,Court 5,DRILL,ALL_LEVELS,4,8,18,"Wyatt Young; Chloe Allen; Lisa Park; Amelia Wilson"
2025-07-20,09:00,10:30,Court 3,CLINIC,INTERMEDIATE,12,16,25,"Lisa Park; Emma Johnson; Sam Roberts; Tom Rivera"
2025-07-20,10:30,12:00,Court 3,OPEN_PLAY,ALL_LEVELS,6,8,18,"Sophie Taylor; Chris Taylor; Aiden Thomas; Charlotte Davis; Olivia Turner; Ava White"
2025-07-20,12:00,13:30,Court 5,OPEN_PLAY,ALL_LEVELS,6,12,15,"Ryan Foster; Sarah Mitchell; Grace Hall; Victoria Hernandez; Maria Santos; Aurora Torres"
2025-07-20,15:00,16:30,Court 3,OPEN_PLAY,ALL_LEVELS,8,12,12,"Tom Rivera; Sophie Taylor; Kevin Lee; Lisa Park; Logan Garcia; Jennifer Liu; Henry Nelson; Nina Lopez"
2025-07-21,09:00,10:30,Court 4,OPEN_PLAY,ALL_LEVELS,7,8,15,"Lisa Park; James Wilson; Chris Taylor; Sophia Lee; Lucas Martin; Logan Garcia"
2025-07-21,12:00,13:30,Court 2,CLINIC,BEGINNER,10,16,25,"Jayden Ward; Anna Garcia; Carter Thompson; Joshua Ross; Chloe Allen; Kevin Lee; Noah Harris; Isabella Clark; Sophia Lee"
2025-07-21,13:30,15:00,Court 6,OPEN_PLAY,ALL_LEVELS,3,8,15,"Lincoln Price; Savannah Sanders"
2025-07-21,15:00,16:30,Court 2,SOCIAL,ALL_LEVELS,6,8,15,"Maria Santos; Wyatt Young; Anna Garcia; Aiden Thomas"
2025-07-21,16:30,18:00,Court 6,OPEN_PLAY,ALL_LEVELS,11,12,15,"David Brown; Ezra Griffin; Priya Sharma; Chris Taylor; Amelia Wilson; Charlotte Davis; Jake Rodriguez; Kelly Wright; Sarah Mitchell"
2025-07-21,18:00,19:30,Court 1,LEAGUE_PLAY,INTERMEDIATE,4,4,40,"Ella Green; Emma Johnson; Mike Chen; Lincoln Price"
2025-07-21,19:30,21:00,Court 4,CLINIC,BEGINNER,16,16,25,"Ruby Bryant; Priya Sharma; Charlotte Davis"
2025-07-22,07:30,09:00,Court 1,OPEN_PLAY,ALL_LEVELS,5,12,15,"Priya Sharma; Maria Santos; Kevin Lee; Mike Chen; Stella Gray"
2025-07-22,10:30,12:00,Court 1,SOCIAL,ALL_LEVELS,9,16,10,"James Wilson; Chloe Allen; Tom Rivera; Nina Lopez; Lisa Park; Alex Rivera"
2025-07-22,13:30,15:00,Court 1,OPEN_PLAY,ALL_LEVELS,5,12,12,"Maria Santos; James Wilson; Lily Murphy; Chris Taylor; Sarah Mitchell"
2025-07-22,16:30,18:00,Court 6,OPEN_PLAY,ALL_LEVELS,11,12,12,"Anna Garcia; Charlotte Davis; Mason Brown; Henry Nelson; Aiden Thomas; Abigail Robinson; Kevin Lee; Priya Sharma; Jennifer Liu; Daniel Rogers; Liam Nelson"
2025-07-23,06:00,07:30,Court 3,LEAGUE_PLAY,INTERMEDIATE,1,4,50,"Sophia Lee"
2025-07-23,07:30,09:00,Court 6,LEAGUE_PLAY,INTERMEDIATE,2,4,35,"Abigail Robinson; Ethan Moore"
2025-07-23,09:00,10:30,Court 6,SOCIAL,ALL_LEVELS,12,16,10,"Evelyn Martinez; Tom Rivera; Chris Taylor; Sophia Lee; Isabella Clark; Scarlett Baker; Brandon Hall; Alex Rivera"
2025-07-23,10:30,12:00,Court 1,DRILL,ALL_LEVELS,3,6,15,"Ryan Foster; Tom Rivera; Nora Morgan"
2025-07-23,12:00,13:30,Court 6,SOCIAL,ALL_LEVELS,3,8,15,"Anna Garcia; Jennifer Liu; Emily Hill"
2025-07-23,13:30,15:00,Court 6,OPEN_PLAY,ALL_LEVELS,5,12,18,"Sarah Mitchell; Maria Santos; Elijah Anderson; Tom Rivera"
2025-07-23,15:00,16:30,Court 6,SOCIAL,ALL_LEVELS,4,8,15,"Maria Santos; Ryan Foster; Kevin Lee; Priya Sharma"
2025-07-23,16:30,18:00,Court 4,OPEN_PLAY,ALL_LEVELS,7,8,15,"Kelly Wright; David Brown; James Wilson; Chloe Allen"
2025-07-23,19:30,21:00,Court 1,OPEN_PLAY,ALL_LEVELS,6,8,15,"Lisa Park; Brandon Hall; Mike Chen; Sebastian Wright; Charlotte Davis"
2025-07-24,07:30,09:00,Court 3,SOCIAL,ALL_LEVELS,9,16,10,"Willow Diaz; Zoey Reed; Sarah Mitchell; Grayson Powell; Lily Murphy; Jeremiah Morgan; Audrey Evans; Kinsley Bennett; Chris Taylor"
2025-07-24,09:00,10:30,Court 1,LEAGUE_PLAY,ADVANCED,3,4,50,"Luke Hayes; Emily Hill; Maria Santos"
2025-07-24,10:30,12:00,Court 3,OPEN_PLAY,ALL_LEVELS,4,8,12,"Ella Green; Emma Johnson; Sophie Taylor; Sebastian Wright"
2025-07-24,12:00,13:30,Court 5,OPEN_PLAY,ALL_LEVELS,6,12,15,"David Brown; Mike Chen; Jennifer Liu; Lisa Park; James Wilson"
2025-07-24,13:30,15:00,Court 2,CLINIC,BEGINNER,5,16,25,"Logan Garcia; Evelyn Martinez; Charlotte Davis; Abigail Robinson; Harper Jackson"
2025-07-25,06:00,07:30,Court 4,LEAGUE_PLAY,ADVANCED,1,4,40,"Aiden Thomas"
2025-07-25,07:30,09:00,Court 3,OPEN_PLAY,ALL_LEVELS,6,12,15,"Emma Johnson; Megan Scott; Mason Brown; Maria Santos; Anna Garcia; Sam Roberts"
2025-07-25,09:00,10:30,Court 3,DRILL,ALL_LEVELS,5,8,18,"Emma Johnson; Mike Chen; Wyatt Young; Nina Lopez; Jake Rodriguez"
2025-07-25,10:30,12:00,Court 2,SOCIAL,ALL_LEVELS,8,16,10,"Paisley Barnes; Jennifer Liu; Victoria Hernandez; Logan Garcia"
2025-07-25,13:30,15:00,Court 6,OPEN_PLAY,ALL_LEVELS,4,8,15,"Mike Chen; Aiden Thomas; Jackson Bailey; Noah Harris"
2025-07-25,15:00,16:30,Court 3,SOCIAL,ALL_LEVELS,4,8,10,"David Brown; Lisa Park; Gabriel Cook; Lily Murphy"
2025-07-25,16:30,18:00,Court 6,OPEN_PLAY,ALL_LEVELS,7,8,12,"Owen Adams; Rachel Kim; Evelyn Martinez; Jaxon Ross; Lisa Park; Sarah Mitchell"
2025-07-25,18:00,19:30,Court 5,OPEN_PLAY,ALL_LEVELS,12,12,18,"Eleanor Ward; James Wilson; Jake Rodriguez; Savannah Sanders; Lisa Park; Priya Sharma"
2025-07-26,09:00,10:30,Court 1,SOCIAL,ALL_LEVELS,6,8,15,"Alex Rivera; Sophie Taylor; Ethan Moore; Wyatt Young; Penelope Lewis"
2025-07-26,10:30,12:00,Court 2,CLINIC,INTERMEDIATE,8,12,20,"Ryan Foster; Elijah Anderson; Lisa Park; Logan Garcia; Carter Thompson; Alex Rivera; Jake Rodriguez; Sophie Taylor"
2025-07-26,16:30,18:00,Court 3,DRILL,ALL_LEVELS,5,6,18,"Mark Johnson; Alex Rivera; Grace Hall; Lincoln Price; Paisley Barnes"
2025-07-26,19:30,21:00,Court 6,SOCIAL,ALL_LEVELS,13,16,15,"Maria Santos; Kevin Lee; Sophie Taylor; Anna Garcia; Rachel Kim; Colton Wood; Mark Johnson"
2025-07-26,21:00,22:00,Court 1,OPEN_PLAY,ALL_LEVELS,3,8,18,"Kevin Lee; Amelia Wilson; Sophie Taylor"
2025-07-27,06:00,07:30,Court 2,OPEN_PLAY,ALL_LEVELS,3,8,18,"Mark Johnson; Mike Chen; Maria Santos"
2025-07-27,07:30,09:00,Court 1,OPEN_PLAY,ALL_LEVELS,5,12,15,"Emma Johnson; Mason Brown; David Brown; Sarah Mitchell; Joshua Ross"
2025-07-27,09:00,10:30,Court 3,SOCIAL,ALL_LEVELS,11,16,10,"Tom Rivera; Caleb King"
2025-07-27,10:30,12:00,Court 6,DRILL,ALL_LEVELS,4,6,18,"Logan Garcia; James Wilson; Tom Rivera; Ethan Moore"
2025-07-27,12:00,13:30,Court 4,OPEN_PLAY,ALL_LEVELS,5,8,18,"Carter Thompson; Gabriel Cook; Grace Hall; Cameron Howard; Kevin Lee"
2025-07-27,13:30,15:00,Court 3,OPEN_PLAY,ALL_LEVELS,6,12,12,"Jaxon Ross; Abigail Robinson; Kelly Wright; Tom Rivera; Lincoln Price"
2025-07-27,15:00,16:30,Court 5,OPEN_PLAY,ALL_LEVELS,8,12,12,"Jack Scott; Mark Johnson"
2025-07-27,16:30,18:00,Court 3,OPEN_PLAY,ALL_LEVELS,7,8,12,"Owen Adams; Sophie Taylor; Rachel Kim; Paisley Barnes"
2025-07-27,18:00,19:30,Court 6,SOCIAL,ALL_LEVELS,7,8,15,"Priya Sharma; Mike Chen; Sophie Taylor; Kevin Lee; Harper Jackson; Grace Hall; Caleb King"
2025-07-27,19:30,21:00,Court 1,OPEN_PLAY,ALL_LEVELS,8,8,18,"Maria Santos; Isabella Clark; Grace Hall; Carter Thompson; Tom Rivera; Kevin Lee; Lincoln Price"
2025-07-28,07:30,09:00,Court 4,OPEN_PLAY,ALL_LEVELS,7,12,15,"Diana Park; Kevin Lee; Charlotte Davis; Alex Rivera; Abigail Robinson; Jack Scott; Matthew Bell"
2025-07-28,09:00,10:30,Court 3,CLINIC,INTERMEDIATE,12,16,25,"Rachel Kim; Emma Johnson; Elijah Anderson; David Brown; Eleanor Ward; Alex Rivera"
2025-07-28,12:00,13:30,Court 1,DRILL,ALL_LEVELS,4,8,18,"Sophia Lee; Chris Taylor; David Brown; Jennifer Liu"
2025-07-28,13:30,15:00,Court 5,SOCIAL,ALL_LEVELS,4,8,10,"Aiden Thomas; Jake Rodriguez; Hazel Fisher; Joshua Ross"
2025-07-28,15:00,16:30,Court 5,OPEN_PLAY,ALL_LEVELS,9,12,18,"Mark Johnson; Abigail Robinson; Mateo Cruz"
2025-07-28,19:30,21:00,Court 3,OPEN_PLAY,ALL_LEVELS,6,8,18,"Levi Mitchell; Emma Johnson; Bella Bennett; Maria Santos; Lucas Martin; Harper Jackson"
2025-07-28,21:00,22:00,Court 4,OPEN_PLAY,ALL_LEVELS,3,8,12,"Harper Jackson; Maria Santos"
2025-07-29,06:00,07:30,Court 6,CLINIC,BEGINNER,3,12,25,"Kevin Lee; Mike Chen; Sam Roberts"
2025-07-29,09:00,10:30,Court 1,CLINIC,INTERMEDIATE,6,8,25,"Tom Rivera; Priya Sharma"
2025-07-29,10:30,12:00,Court 5,OPEN_PLAY,ALL_LEVELS,5,8,12,"Kevin Lee; Tom Rivera; Brandon Hall; Carter Thompson; Penelope Lewis"
2025-07-29,12:00,13:30,Court 5,OPEN_PLAY,ALL_LEVELS,7,12,18,"Henry Nelson; Nina Lopez; James Wilson"
2025-07-29,13:30,15:00,Court 6,LEAGUE_PLAY,INTERMEDIATE,1,4,35,"Olivia Turner"
2025-07-29,16:30,18:00,Court 2,OPEN_PLAY,ALL_LEVELS,8,8,18,"Rachel Kim; Emma Johnson; Mike Chen; Ethan Moore; Amelia Wilson; Jackson Bailey; Samuel Cox; Nova Hughes"
2025-07-29,18:00,19:30,Court 2,OPEN_PLAY,ALL_LEVELS,9,12,12,"Scarlett Baker; Rachel Kim; Olivia Turner; Thomas Flores; Liam Nelson"
2025-07-29,19:30,21:00,Court 6,OPEN_PLAY,ALL_LEVELS,7,12,15,"Sarah Mitchell; Chloe Allen; Tom Rivera; Lucas Martin"
2025-07-29,21:00,22:00,Court 6,LEAGUE_PLAY,ADVANCED,2,4,40,"Levi Mitchell; Sebastian Wright"
2025-07-30,06:00,07:30,Court 4,OPEN_PLAY,ALL_LEVELS,4,12,18,"Anna Garcia; Cameron Howard"
2025-07-30,10:30,12:00,Court 6,SOCIAL,ALL_LEVELS,5,8,10,"Jake Rodriguez; Kelly Wright; Mark Johnson; Ezra Griffin; Tom Rivera"
2025-07-30,12:00,13:30,Court 5,DRILL,ALL_LEVELS,4,8,18,"Priya Sharma; Chris Taylor; Aiden Thomas; Tom Rivera"
2025-07-30,13:30,15:00,Court 2,OPEN_PLAY,ALL_LEVELS,5,12,18,"Harper Jackson; Kevin Lee; Priya Sharma; Sebastian Wright; David Brown"
2025-07-30,15:00,16:30,Court 5,OPEN_PLAY,ALL_LEVELS,4,8,12,"Mark Johnson; Tom Rivera; Benjamin Walker"
2025-07-30,18:00,19:30,Court 2,OPEN_PLAY,ALL_LEVELS,9,12,15,"Aiden Thomas; Owen Adams; Lucas Martin; Emma Johnson; Zoey Reed; Liam Nelson"
2025-07-30,21:00,22:00,Court 2,OPEN_PLAY,ALL_LEVELS,3,8,12,"Chris Taylor; Emma Johnson"
2025-07-31,07:30,09:00,Court 1,DRILL,ALL_LEVELS,3,6,18,"Lisa Park; Emma Johnson; James Wilson"
2025-07-31,09:00,10:30,Court 1,SOCIAL,ALL_LEVELS,7,8,10,"Sarah Mitchell; Tom Rivera; Kelly Wright"
2025-07-31,13:30,15:00,Court 4,DRILL,ALL_LEVELS,3,8,18,"Owen Adams; Priya Sharma; Harper Jackson"
2025-07-31,15:00,16:30,Court 4,OPEN_PLAY,ALL_LEVELS,6,12,18,"Grace Hall; Ryan Foster; Lisa Park; Mike Chen; Sophia Lee; Sophie Taylor"
2025-07-31,16:30,18:00,Court 2,DRILL,ALL_LEVELS,4,6,18,"Kevin Lee; Scarlett Baker; Lisa Park; Mateo Cruz"
2025-07-31,18:00,19:30,Court 1,CLINIC,BEGINNER,7,8,30,"Emily Hill; Priya Sharma; Megan Scott; Rachel Kim; Chris Taylor"
2025-07-31,21:00,22:00,Court 4,CLINIC,BEGINNER,7,16,25,"Carter Thompson; Mateo Cruz; Evelyn Martinez; Kevin Lee; Levi Mitchell; Sam Roberts; Elijah Anderson"
2025-08-01,13:30,15:00,Court 2,OPEN_PLAY,ALL_LEVELS,4,12,18,"Tom Rivera; Chloe Allen; Nora Morgan"
2025-08-01,15:00,16:30,Court 5,OPEN_PLAY,ALL_LEVELS,5,12,15,"Alex Rivera; Kevin Lee; Evelyn Martinez"
2025-08-01,16:30,18:00,Court 1,OPEN_PLAY,ALL_LEVELS,10,12,12,"Anna Garcia"
2025-08-01,18:00,19:30,Court 4,OPEN_PLAY,ALL_LEVELS,8,8,18,"Priya Sharma; Harper Jackson; Sebastian Wright"
2025-08-01,19:30,21:00,Court 5,SOCIAL,ALL_LEVELS,13,16,15,"Scarlett Baker; Alex Rivera; Diana Park; Grayson Powell; Olivia Turner; Rachel Kim; Chris Taylor; Evelyn Martinez"
2025-08-01,21:00,22:00,Court 1,CLINIC,INTERMEDIATE,7,16,20,"Priya Sharma; Lisa Park; Anna Garcia"
2025-08-02,06:00,07:30,Court 5,CLINIC,INTERMEDIATE,3,16,25,"Kevin Lee; David Brown; Priya Sharma"
2025-08-02,07:30,09:00,Court 3,OPEN_PLAY,ALL_LEVELS,4,12,15,"Evelyn Martinez; Sophie Taylor; Emma Johnson; Ryan Foster"
2025-08-02,09:00,10:30,Court 2,SOCIAL,ALL_LEVELS,4,8,10,"Jack Scott; Sophia Lee; Isaiah Coleman"
2025-08-02,10:30,12:00,Court 2,DRILL,ALL_LEVELS,5,8,20,"Victoria Hernandez; Cameron Howard; Noah Harris; Rachel Kim"
2025-08-02,15:00,16:30,Court 6,OPEN_PLAY,ALL_LEVELS,7,12,12,"Sarah Mitchell; Jennifer Liu; Amelia Wilson; Diana Park"
2025-08-03,06:00,07:30,Court 3,OPEN_PLAY,ALL_LEVELS,2,8,12,"Anna Garcia; Emma Johnson"
2025-08-03,07:30,09:00,Court 1,OPEN_PLAY,ALL_LEVELS,5,12,18,"Victoria Hernandez; Sebastian Wright; Mason Brown; Anna Garcia; Nina Lopez"
2025-08-03,09:00,10:30,Court 6,SOCIAL,ALL_LEVELS,7,8,10,"Wyatt Young; Maria Santos; Victoria Hernandez; Gabriel Cook; Chris Taylor; Mike Chen; Brandon Hall"
2025-08-03,10:30,12:00,Court 1,SOCIAL,ALL_LEVELS,5,8,10,"Penelope Lewis; James Wilson; Tom Rivera; Charlotte Davis; Sophia Lee"
2025-08-03,12:00,13:30,Court 2,CLINIC,INTERMEDIATE,7,12,30,"Sebastian Wright; Mike Chen; Kevin Lee; Logan Garcia; Aria Long"
2025-08-03,15:00,16:30,Court 1,OPEN_PLAY,ALL_LEVELS,7,12,12,"Adrian Brooks; Lucas Martin; Amelia Wilson; Charlotte Davis; Mason Brown; Addison Howard"
2025-08-03,16:30,18:00,Court 6,CLINIC,INTERMEDIATE,12,12,30,"Claire Barnes; Mike Chen; Rachel Kim; Sophie Taylor; Alex Rivera; Mason Brown"
2025-08-03,19:30,21:00,Court 6,OPEN_PLAY,ALL_LEVELS,7,8,18,"Priya Sharma; Carter Thompson; Liam Nelson; Owen Adams; Zoey Reed"
2025-08-03,21:00,22:00,Court 3,OPEN_PLAY,ALL_LEVELS,3,8,15,"Savannah Sanders; Mason Brown"
2025-08-04,09:00,10:30,Court 3,CLINIC,INTERMEDIATE,6,8,20,"Wyatt Young; Olivia Turner; Mike Chen; Sophia Lee; David Brown; Lucas Martin"
2025-08-04,10:30,12:00,Court 1,LEAGUE_PLAY,ADVANCED,3,4,50,"Lily Murphy; Kelly Wright; Rachel Kim"
2025-08-04,13:30,15:00,Court 3,LEAGUE_PLAY,ADVANCED,2,4,35,"Chris Taylor; Gabriel Cook"
2025-08-04,15:00,16:30,Court 1,OPEN_PLAY,ALL_LEVELS,6,8,12,"Sarah Mitchell; Maria Santos; Victoria Hernandez; Aiden Thomas; Benjamin Walker; Lisa Park"
2025-08-04,16:30,18:00,Court 4,SOCIAL,ALL_LEVELS,12,16,10,"Ava White; Rachel Kim; Sebastian Wright; Riley Stewart; Jackson Bailey; Paisley Barnes; David Brown; Sophie Taylor"
2025-08-04,18:00,19:30,Court 4,OPEN_PLAY,ALL_LEVELS,10,12,18,"Lisa Park; James Wilson; Anna Garcia; Tom Rivera; Nina Lopez; Bella Bennett"
2025-08-05,12:00,13:30,Court 1,DRILL,ALL_LEVELS,3,6,15,"Henry Nelson; Sophia Lee; Grace Hall"
2025-08-05,13:30,15:00,Court 1,LEAGUE_PLAY,ADVANCED,1,4,40,"James Wilson"
2025-08-05,15:00,16:30,Court 3,OPEN_PLAY,ALL_LEVELS,5,8,18,"Priya Sharma; David Brown; Diana Park; Charlotte Davis; Sarah Mitchell"
2025-08-05,16:30,18:00,Court 5,LEAGUE_PLAY,INTERMEDIATE,2,4,50,"James Wilson; Mark Johnson"
2025-08-05,18:00,19:30,Court 3,OPEN_PLAY,ALL_LEVELS,12,12,15,"Lisa Park; Sarah Mitchell; Logan Garcia; Mike Chen"
2025-08-05,19:30,21:00,Court 1,CLINIC,BEGINNER,5,8,30,"Mark Johnson; Ethan Moore; Caleb King; Savannah Sanders; Ella Green"
2025-08-05,21:00,22:00,Court 3,CLINIC,BEGINNER,5,16,25,"Lisa Park; Samuel Cox; Ruby Bryant; Ella Green; Caleb King"
2025-08-06,06:00,07:30,Court 1,LEAGUE_PLAY,ADVANCED,1,4,35,"Sarah Mitchell"
2025-08-06,10:30,12:00,Court 6,SOCIAL,ALL_LEVELS,8,16,10,"David Brown"
2025-08-06,12:00,13:30,Court 3,DRILL,ALL_LEVELS,2,6,20,"Sarah Mitchell; Anna Garcia"
2025-08-06,13:30,15:00,Court 5,OPEN_PLAY,ALL_LEVELS,5,12,18,"Olivia Turner; Anna Garcia; Maria Santos; Alex Rivera; Jennifer Liu"
2025-08-06,15:00,16:30,Court 6,DRILL,ALL_LEVELS,3,6,15,"Sebastian Wright; Elijah Anderson; David Brown"
2025-08-06,16:30,18:00,Court 5,OPEN_PLAY,ALL_LEVELS,9,12,15,"Henry Nelson; Mike Chen; Tom Rivera; Lisa Park"
2025-08-06,18:00,19:30,Court 1,OPEN_PLAY,ALL_LEVELS,11,12,12,"Anna Garcia; Emma Johnson; Tom Rivera"
2025-08-07,06:00,07:30,Court 1,SOCIAL,ALL_LEVELS,4,16,10,"Nina Lopez; Priya Sharma; Emma Johnson; Victoria Hernandez"
2025-08-07,07:30,09:00,Court 6,OPEN_PLAY,ALL_LEVELS,4,12,18,"David Brown; James Wilson; Elijah Anderson; Logan Garcia"
2025-08-07,09:00,10:30,Court 2,OPEN_PLAY,ALL_LEVELS,9,12,18,"Aiden Thomas; Tom Rivera; Mike Chen; Anna Garcia"
2025-08-07,10:30,12:00,Court 2,DRILL,ALL_LEVELS,4,6,15,"Maria Santos; Colton Wood; Addison Howard"
2025-08-07,12:00,13:30,Court 6,CLINIC,INTERMEDIATE,4,8,20,"Mike Chen; Evelyn Martinez; Adrian Brooks"
2025-08-07,13:30,15:00,Court 5,DRILL,ALL_LEVELS,3,6,15,"Mike Chen; Kinsley Bennett; Isabella Clark"
2025-08-07,16:30,18:00,Court 3,OPEN_PLAY,ALL_LEVELS,7,8,12,"Sarah Mitchell; James Wilson; Amelia Wilson; Sophia Lee; Kevin Lee"
2025-08-07,18:00,19:30,Court 2,OPEN_PLAY,ALL_LEVELS,10,12,15,"Sarah Mitchell; Chloe Allen; Sophie Taylor; Brandon Hall; Savannah Sanders"
